{
  "_type": "https://in-toto.io/Statement/v1",
  "subject": [
    {
      "name": "hallucinated.vel",
      "digest": {
        "sha256": "7014a1c71a2c48da9b8e1d2b79f289eb0dc177c3a0238d908d57253bf7658704"
      }
    }
  ],
  "predicateType": "https://sabline.dev/receipt/v1",
  "predicate": {
    "schema": "sabline.receipt/1",
    "producer": {
      "name": "sabline-lang",
      "uri": "https://github.com/gowrishankar-infra/sabline-lang",
      "version": "<version>"
    },
    "specification": "sabline-spec <version>",
    "startedAt": "<varies>",
    "wall_time_ms": "<varies>",
    "budget": "io",
    "run_parameters": {
      "seed": null,
      "freeze_time": null,
      "timeout": null,
      "max_memory_mb": null,
      "max_read_bytes": 67108864,
      "confinement": "<varies by operating system>",
      "confinement_reason": "<varies by operating system>",
      "confinement_layers": "<varies by operating system>",
      "os_policy_sha256": "<varies by operating system>",
      "ceilings": []
    },
    "effects_used": {},
    "grants_used": [],
    "refusals": [],
    "declassifications": [],
    "exit": {
      "status": 1,
      "outcome": "did_not_compile",
      "code": "E512"
    },
    "complete": true
  }
}
