{
  "_type": "https://in-toto.io/Statement/v1",
  "subject": [
    {
      "name": "same_program_kept.vel",
      "digest": {
        "sha256": "3f6c8e96f6f826978393cf99bf734b7d648e9a87e715f48bc565fd7f882c2b48"
      }
    }
  ],
  "predicateType": "https://sabline.dev/receipt/v1",
  "predicate": {
    "schema": "sabline.receipt/1",
    "producer": {
      "name": "sabline-lang",
      "uri": "https://github.com/gowrishankar-infra/sabline-lang",
      "version": "<version>"
    },
    "specification": "sabline-spec <version>",
    "startedAt": "<varies>",
    "wall_time_ms": "<varies>",
    "budget": "env,io",
    "run_parameters": {
      "seed": null,
      "freeze_time": null,
      "timeout": null,
      "max_memory_mb": null,
      "max_read_bytes": 67108864,
      "confinement": "<varies by operating system>",
      "confinement_reason": "<varies by operating system>",
      "confinement_layers": "<varies by operating system>",
      "os_policy_sha256": "<varies by operating system>",
      "ceilings": []
    },
    "effects_used": {
      "env": 1,
      "io": 2
    },
    "grants_used": [],
    "refusals": [],
    "declassifications": [],
    "exit": {
      "status": 0,
      "outcome": "ok",
      "code": null
    },
    "complete": true
  }
}
