{
  "_type": "https://in-toto.io/Statement/v1",
  "subject": [
    {
      "name": "drop_table.vel",
      "digest": {
        "sha256": "0e9e66c6f5be24a6faf73fa68335c4cd9f152e76e80c25ae2e96e8fcb0dfa617"
      }
    },
    {
      "name": "<stdlib>/db.vel",
      "digest": {
        "sha256": "1f2e36405803e0fc9e31667244d6995582d8e3696a698a5f94b47458e8b3b205"
      }
    }
  ],
  "predicateType": "https://sabline.dev/receipt/v1",
  "predicate": {
    "schema": "sabline.receipt/1",
    "producer": {
      "name": "sabline-lang",
      "uri": "https://github.com/gowrishankar-infra/sabline-lang",
      "version": "<version>"
    },
    "specification": "sabline-spec <version>",
    "startedAt": "<varies>",
    "wall_time_ms": "<varies>",
    "budget": "ffi:json,fs:read:./data,fs:write:./data,io",
    "run_parameters": {
      "seed": null,
      "freeze_time": null,
      "timeout": null,
      "max_memory_mb": null,
      "max_read_bytes": 67108864,
      "confinement": "<varies by operating system>",
      "confinement_reason": "<varies by operating system>",
      "confinement_layers": "<varies by operating system>",
      "os_policy_sha256": "<varies by operating system>"
    },
    "effects_used": {
      "ffi": 1
    },
    "grants_used": [],
    "refusals": [
      {
        "code": "E311",
        "effect": "ffi",
        "line": 7,
        "stopped": true,
        "times": 1
      }
    ],
    "declassifications": [],
    "exit": {
      "status": 1,
      "outcome": "refused",
      "code": "E311"
    },
    "complete": true
  }
}
